Year,Wine ID,User Rating,Note,CreatedAt,Winery,Wine,Rating,Rates count
1952,1227674,3.5,美味しい！,2022-04-10T11:13:32.000Z,Cantina Sampietrana,Since 1952 Riserva 1952,4.4,48
1952,1227674,3.5,"
",2021-04-25T18:17:15.000Z,Cantina Sampietrana,Since 1952 Riserva 1952,4.4,48
1952,1227674,3.0,Nice and full bodied! Nothing too special otherwise but still nice with Italian food!,2017-04-15T17:21:33.000Z,Cantina Sampietrana,Since 1952 Riserva 1952,4.4,48
1952,1227674,5.0,"Perfect wine, for good price",2014-12-31T17:02:32.000Z,Cantina Sampietrana,Since 1952 Riserva 1952,4.4,48
1952,1227674,3.5,Trocken und gut,2019-05-14T21:15:56.000Z,Cantina Sampietrana,Since 1952 Riserva 1952,4.4,48
1952,1227674,3.4,"London med paps. Rådyr og halvveis tapas, men vinen var heldigvis meget god. Frisk, og sklir godt selv med god fylde",2023-04-15T19:14:53.000Z,Cantina Sampietrana,Since 1952 Riserva 1952,4.4,48
1952,1227674,4.8,Wunderbarer Geschmack nach vollreifen Kirschen. Passt gut zu rotem Fleisch oder auch einfach zu Brot. Sehr angenehm zu trinken. Super lecker ,2023-02-07T19:00:53.000Z,Cantina Sampietrana,Since 1952 Riserva 1952,4.4,48
1952,1227674,5.0,"Earthy, long finish, full bodied",2017-03-04T21:49:42.000Z,Cantina Sampietrana,Since 1952 Riserva 1952,4.4,48
1952,1227674,5.0,Great value for the quality,2014-11-08T20:05:54.000Z,Cantina Sampietrana,Since 1952 Riserva 1952,4.4,48
1952,1227674,3.0,"Not good as value 
",2020-11-13T11:02:02.000Z,Cantina Sampietrana,Since 1952 Riserva 1952,4.4,48
1952,1227674,5.0,Fantastic value for money. Love this wine.  Where to buy it in DK??,2014-08-13T18:29:17.000Z,Cantina Sampietrana,Since 1952 Riserva 1952,4.4,48
1952,1227674,5.0,Mega. Nice in the sunshine with a bbq steak. Rich but not too heavy. ,2016-04-19T19:21:01.000Z,Cantina Sampietrana,Since 1952 Riserva 1952,4.4,48
1952,1227674,5.0,Niiiiiiiccee. Notes of sliced bread. And beef stroganoff,2015-09-25T21:39:53.000Z,Cantina Sampietrana,Since 1952 Riserva 1952,4.4,48
1952,1227674,2.0,Past perfect bij wokgerecht Wild @,2022-04-03T11:15:19.000Z,Cantina Sampietrana,Since 1952 Riserva 1952,4.4,48
1952,1227674,5.0,"Fruity, smooth once decanted ",2015-10-22T17:51:42.000Z,Cantina Sampietrana,Since 1952 Riserva 1952,4.4,48
1952,1227674,2.0,"Easy to drink, hints of cloves, all spice, tobacco & thyme. Good value for money.",2015-02-01T18:02:30.000Z,Cantina Sampietrana,Since 1952 Riserva 1952,4.4,48
1952,1227674,5.0,Unreal. Paid 20e in restaurant il colibri,2021-11-20T20:48:18.000Z,Cantina Sampietrana,Since 1952 Riserva 1952,4.4,48
1952,1227674,3.0,Easy drinking. Dehesa soho.,2019-06-13T12:47:21.000Z,Cantina Sampietrana,Since 1952 Riserva 1952,4.4,48
1952,1227674,2.5,Sophie wasn’t a fan,2018-02-18T09:07:48.000Z,Cantina Sampietrana,Since 1952 Riserva 1952,4.4,48
1952,1227674,5.0,"Very smooth and delicate taste. Dry but not sour. I'll buy it again, for sure.",2014-12-01T17:58:12.000Z,Cantina Sampietrana,Since 1952 Riserva 1952,4.4,48
1952,1227674,3.0,😀,2020-04-20T19:12:22.000Z,Cantina Sampietrana,Since 1952 Riserva 1952,4.4,48
1952,1227674,3.5,"タンニン渋め強め
イタリア　プーリア州",2020-08-10T12:05:19.000Z,Cantina Sampietrana,Since 1952 Riserva 1952,4.4,48
1952,1227674,3.5,"Vin riche et relativement puissant, accompagne bien des produits au goût relevé ",2018-06-28T12:20:56.000Z,Cantina Sampietrana,Since 1952 Riserva 1952,4.4,48
1952,1227674,3.5,"Eigentlich gut mit viel Kirsche und Pflaume, aber etwas zu wenig trocken für meinen Geschmack",2020-03-04T19:31:59.000Z,Cantina Sampietrana,Since 1952 Riserva 1952,4.4,48
1952,1227674,3.5,"Afbalanceret vin med god smag af brombær, bløde tanniner, let krydret.",2015-04-24T19:06:57.000Z,Cantina Sampietrana,Since 1952 Riserva 1952,4.4,48
1952,1227674,3.5,"Preislesitung, einfach aber einfach Grund solide ",2019-11-19T19:13:55.000Z,Cantina Sampietrana,Since 1952 Riserva 1952,4.4,48
1952,1227674,3.0,"2300 濃い、、渋い、、
翌日以降にまろやかになって飲めた。",2021-04-30T10:25:08.000Z,Cantina Sampietrana,Since 1952 Riserva 1952,4.4,48
1952,1227674,3.5,Lekkere smaak en erg zacht.,2023-04-16T22:13:41.000Z,Cantina Sampietrana,Since 1952 Riserva 1952,4.4,48
1952,1227674,3.0,"Eher flach. Ok, aber ohne Klasse.",2020-10-03T18:40:44.000Z,Cantina Sampietrana,Since 1952 Riserva 1952,4.4,48
1952,1227674,5.0,"Boenk erop, tip van Warre.
Bij Pasen thuis gedronken",2021-04-04T12:37:46.000Z,Cantina Sampietrana,Since 1952 Riserva 1952,4.4,48
1952,1227674,3.0,"
",2022-01-03T08:54:24.000Z,Cantina Sampietrana,Since 1952 Riserva 1952,4.4,48
1952,1227674,5.0,Smokey,2014-09-22T21:22:37.000Z,Cantina Sampietrana,Since 1952 Riserva 1952,4.4,48
1952,1227674,3.0,"Zu fruchtig
",2018-04-06T19:23:53.000Z,Cantina Sampietrana,Since 1952 Riserva 1952,4.4,48
1952,1227674,5.0,Great,2017-12-10T20:28:55.000Z,Cantina Sampietrana,Since 1952 Riserva 1952,4.4,48
1952,1227674,5.0,"
",2021-10-17T19:27:55.000Z,Cantina Sampietrana,Since 1952 Riserva 1952,4.4,48
1952,1227674,5.0,Best value ! Léger mais fruité ! Un bonheur !,2014-12-17T19:53:13.000Z,Cantina Sampietrana,Since 1952 Riserva 1952,4.4,48
1952,1227674,5.0,trop bong,2015-09-15T20:32:34.000Z,Cantina Sampietrana,Since 1952 Riserva 1952,4.4,48
1952,1227674,5.0,Recommended by Olly ,2016-05-29T13:14:32.000Z,Cantina Sampietrana,Since 1952 Riserva 1952,4.4,48
1952,1227674,5.0,Opera Tavern,2015-08-08T17:50:43.000Z,Cantina Sampietrana,Since 1952 Riserva 1952,4.4,48
1952,1227674,3.0,Ok ,2020-02-13T22:25:46.000Z,Cantina Sampietrana,Since 1952 Riserva 1952,4.4,48
1952,1227674,3.0,Is wine,2022-09-07T19:14:58.000Z,Cantina Sampietrana,Since 1952 Riserva 1952,4.4,48
1952,1227674,5.0,👍,2021-10-15T19:39:28.000Z,Cantina Sampietrana,Since 1952 Riserva 1952,4.4,48
1952,1227674,3.0,2018.12.23購入,2018-12-23T12:32:10.000Z,Cantina Sampietrana,Since 1952 Riserva 1952,4.4,48
1952,1227674,3.0,2,2020-10-30T21:22:59.000Z,Cantina Sampietrana,Since 1952 Riserva 1952,4.4,48
1952,1227674,3.0,古澤亭グラス,2022-03-01T13:22:42.000Z,Cantina Sampietrana,Since 1952 Riserva 1952,4.4,48
1952,1227674,3.0,Corrrct,2016-11-25T21:08:07.000Z,Cantina Sampietrana,Since 1952 Riserva 1952,4.4,48
1952,1227674,3.0,"普通
まぁまぁ甘めだけど渋みあり",2019-02-09T08:56:42.000Z,Cantina Sampietrana,Since 1952 Riserva 1952,4.4,48
1952,1227674,3.0,カワモと飲んだワイン,2019-01-26T11:37:07.000Z,Cantina Sampietrana,Since 1952 Riserva 1952,4.4,48
1952,1227674,2.0,"
",2021-06-20T10:17:44.000Z,Cantina Sampietrana,Since 1952 Riserva 1952,4.4,48
1952,1227674,5.0,Sehr gut,2015-01-02T14:59:36.000Z,Cantina Sampietrana,Since 1952 Riserva 1952,4.4,48
1952,1227674,5.0,Delish ,2016-03-12T23:26:46.000Z,Cantina Sampietrana,Since 1952 Riserva 1952,4.4,48
1952,1227674,4.0,Smooth smoky taste with nice aromas,2013-10-28T00:53:13.000Z,Cantina Sampietrana,Since 1952 Riserva 1952,4.4,48
1952,1227674,3.0,"コストパフォーマンスが良い
酸はしっかりしており、アタックが強めな割には軽やか
チョコレートのニュアンス",2020-12-02T12:42:32.000Z,Cantina Sampietrana,Since 1952 Riserva 1952,4.4,48
1952,1227674,5.0,Himbeersaft!!! Hammer Fruchtbombe ohne Süße und wenig Säure. Dabei vollmundig und sehr aromatisch.,2014-09-21T16:06:19.000Z,Cantina Sampietrana,Since 1952 Riserva 1952,4.4,48
1952,1227674,3.0,"Fruitig niet te zwaar 
Kan je veel van drinken 
",2022-04-28T19:21:38.000Z,Cantina Sampietrana,Since 1952 Riserva 1952,4.4,48
1952,1227674,5.0,Jättegott!,2023-04-13T19:46:10.000Z,Cantina Sampietrana,Since 1952 Riserva 1952,4.4,48
1952,1227674,3.0,"Fijne neus, kersen yoghurt zachtvol van smaak licht tanine 13,5",2017-11-22T18:11:06.000Z,Cantina Sampietrana,Since 1952 Riserva 1952,4.4,48
1952,1227674,5.0,Vollmundig und kraftvoll aber trotzdem nicht schwer mit schönen Frucht Aromen,2021-04-27T22:27:08.000Z,Cantina Sampietrana,Since 1952 Riserva 1952,4.4,48
1952,1227674,2.0,Niet mijn ding,2019-02-17T16:48:46.000Z,Cantina Sampietrana,Since 1952 Riserva 1952,4.4,48
1952,1227674,4.5,Bisher mein Benchmark,2014-08-19T18:45:11.000Z,Cantina Sampietrana,Since 1952 Riserva 1952,4.4,48
2021,1809484,4.5,Il miglior novello assaggiato quest'anno.,2020-11-20T19:20:42.000Z,Cignomoro,Pepe Nero Primitivo Salento 2021,4.3,54
2021,1809484,4.0,"Vinitaly 2018. Bel naso e bella bocca, quwsta cantina i vini li fa bene. Se non si vuole spendere troppo è una buona scelta tra i primitivi.",2018-05-13T16:59:55.000Z,Cignomoro,Pepe Nero Primitivo Salento 2021,4.3,54
2021,1809484,4.0,Buon rosso con poco retrogusto.  ,2023-02-04T19:05:53.000Z,Cignomoro,Pepe Nero Primitivo Salento 2021,4.3,54
2021,1809484,4.5,"Complesso e profondo, con note di liquirizia, cioccolato e caffè, disteso e persistente.",2023-08-03T09:55:23.000Z,Cignomoro,Pepe Nero Primitivo Salento 2021,4.3,54
2021,1809484,4.5,"Ruby colour, black fruit and blackberry jam aroma, blueberry taste, smooth and sweet taste, long pepper finish.",2023-09-26T19:19:49.000Z,Cignomoro,Pepe Nero Primitivo Salento 2021,4.3,54
2021,1809484,3.5,"Very simple, easy wine. Fruty, cherry, medium to low tanins. A bit a vanilla and jam feeling. Short lenght but perfect during a pizza dinner.",2022-12-31T12:35:57.000Z,Cignomoro,Pepe Nero Primitivo Salento 2021,4.3,54
2021,1809484,5.0,"Just the perfect wine. This Primitivo is stylish and rich, with generous dark fruit and a supple palate framed by licorice, spice and chocolate notes. Soft tannins and mouthwatering acidity make it a winner.
",2022-11-13T08:21:28.000Z,Cignomoro,Pepe Nero Primitivo Salento 2021,4.3,54
2021,1809484,3.0,"Nel complesso un buon primitivo, senza salassarsi un buon compromesso qualità prezzo. Note di bacche di bosco, non tannico, molto amabile con cacciaggione.",2018-12-09T14:03:23.000Z,Cignomoro,Pepe Nero Primitivo Salento 2021,4.3,54
2021,1809484,4.2,"82/💯 Very Good!‼️🇵🇱‼️🇵🇱
www.festiwalwina.com

Festiwal Wina w Lublinie 2023

Partner Center & Sebastian Warpas
 wanilia śliwka wiśnia dąb dżem borówka amerykańska malina figa",2023-09-20T17:44:28.000Z,Cignomoro,Pepe Nero Primitivo Salento 2021,4.3,54
2021,1809484,4.3,"wiśnia, dżem, czarne owoce, śliwka, figa, gałka muszkatołowa, czarna porzeczka ",2023-01-25T17:56:13.000Z,Cignomoro,Pepe Nero Primitivo Salento 2021,4.3,54
2021,1809484,4.5,"Hints of ripe forest fruits, dark cherry and plum blending perfectly with delicate notes of chocolate, tobacco and spices. ",2022-12-17T14:52:07.000Z,Cignomoro,Pepe Nero Primitivo Salento 2021,4.3,54
2021,1809484,4.2,"プリミティーヴォ100%
おいしいけど、やっぱりプリミティーヴォはブレンドのほうが好きかも。
 プラム チェリー コショウ ",2023-02-24T11:22:57.000Z,Cignomoro,Pepe Nero Primitivo Salento 2021,4.3,54
2021,1809484,4.5,vanille chêne chocolat,2022-12-11T17:39:01.000Z,Cignomoro,Pepe Nero Primitivo Salento 2021,4.3,54
2021,1809484,4.5,"Great wine
Strong and powerful taste but still quite easy to drink. Really pleasant aroma

Really good price considering the wine quality ",2022-01-16T12:27:17.000Z,Cignomoro,Pepe Nero Primitivo Salento 2021,4.3,54
2021,1809484,4.2,"Excellent 2020 Cigno Moro Pepe Nero Primitivo Salento.
Intense ruby-red color in the glass, strong nose of blueberries, cherry, cedar, smoke and spices.
Medium(+) aroma of black cherry, overripe plum, fig, raisins, milk chocolate, oak, vanilla and a hint of licorice.
Dry, smooth and velvety, medium(+) complexity, medium(+) alcohol (14%), medium to full body, silky tannins, medium acidity, excellent balanced and a medium to long pleasant aftertaste.
Excellent wine!
Cheers!🍷🍷",2022-03-27T19:48:18.000Z,Cignomoro,Pepe Nero Primitivo Salento 2021,4.3,54
2021,1809484,4.5,"Wow ein guter Wein, schmeckt lecker nach roten Früchten und Vanille. Tief rot und schwer im Glas 

 Vanille Pflaume Eiche @[1|50740086|El loco klaus]",2022-09-04T18:08:28.000Z,Cignomoro,Pepe Nero Primitivo Salento 2021,4.3,54
2021,1809484,4.4,"Heerlijke wijn, zelfs op een brakke dag jamm. Hij ruikt ook erg lekker. Ik proef pruimen, kersen, tabak en een licht vleugje vanille.",2023-10-14T17:21:11.000Z,Cignomoro,Pepe Nero Primitivo Salento 2021,4.3,54
2021,1809484,4.5,"Very good Primitivo Salento. 

Plum, raspberry, jam, honey, vanilla, oak, cheese. Very pleasant nose with the notes of apricot. 

Excellent value for money. ",2022-01-29T20:38:32.000Z,Cignomoro,Pepe Nero Primitivo Salento 2021,4.3,54
2021,1809484,4.5,Chocolate cherry red. Vanilla nose. Cherry chocolate flavours. Smooth and easy to drink. Medium body. Love it. ,2021-01-03T21:47:11.000Z,Cignomoro,Pepe Nero Primitivo Salento 2021,4.3,54
2021,1809484,3.9,"Solid Primitivo! Berries! Hits with plum, red cherry notes. Has some aciditiy and tanins - good balance. Medium bodied. Not too dry.",2023-06-24T12:03:53.000Z,Cignomoro,Pepe Nero Primitivo Salento 2021,4.3,54
2021,1809484,4.0,"Splendid harmonious primitivo, big surprise for me, scent, aromas, acidity , exactly as I like, felt as light wine in its cattegory…👍",2022-01-19T22:01:21.000Z,Cignomoro,Pepe Nero Primitivo Salento 2021,4.3,54
2021,1809484,4.3,"Smooth, full bodied",2023-07-11T15:39:34.000Z,Cignomoro,Pepe Nero Primitivo Salento 2021,4.3,54
2021,1809484,4.1,"Very nice Primitivo. Far above standard.,Balance, fruity, black cherries, vanilla",2022-10-10T21:11:02.000Z,Cignomoro,Pepe Nero Primitivo Salento 2021,4.3,54
2021,1809484,4.3,"Great for steak and ćevap!😂😂
🤩🍷♥️",2023-11-07T18:09:23.000Z,Cignomoro,Pepe Nero Primitivo Salento 2021,4.3,54
2021,1809484,4.1,"Mooie donkere kleur. Mooi rond maar toch oh zo soepel door de mond. Boterzacht met verfijnde rijp rood fruit, en een duidelijke drop toon. Heerlijke soepele zachte afdronk, wat een topper!!",2021-06-16T19:51:09.000Z,Cignomoro,Pepe Nero Primitivo Salento 2021,4.3,54
2021,1809484,4.2,"Chocolat, cerise/grillote, menthole, feuille de coca, réglisse. Très légèrement sucré puis acidulé. Bel équilibre, longueur +, puissant, enivrant  surprenant dans le bon sens du terme !",2022-09-22T19:06:38.000Z,Cignomoro,Pepe Nero Primitivo Salento 2021,4.3,54
2021,1809484,4.0,"Ruby red color, dark berries in taste, dark berries, plums and vanilla in taste, lower tannins, sweetness balanced with acidity at finish. Good value.",2021-06-24T19:13:44.000Z,Cignomoro,Pepe Nero Primitivo Salento 2021,4.3,54
2021,1809484,4.5,"Zo, wat een heerlijke Primitivo. Zeer aangenaam soepel, heerlijk mondgevoel. Beetje boter, beetje iets van drop/stroperigheid. In de smaak volop rood en donker fruit. Kersen en bramen. Ook wat hout. Complex maar goed in balans. Toppertje!  ",2021-12-18T15:32:54.000Z,Cignomoro,Pepe Nero Primitivo Salento 2021,4.3,54
2021,1809484,4.2,"Indtagende dybrød vin med en flot fyldig duft af sorte frugter, vanillesødme og egetræ.
Smagen er fyldig, rund og blød med noter af sorte frugter i form af sorte blommer, kirsebær, brombær og boysenbær. Lidt cedertræ, vanillesødme og eg.
Eftersmagen er lang og delikat, hvor smagsnoterne langsomt aftager, mens der stadig er en flot harmoni mellem dem.",2023-10-04T17:49:08.000Z,Cignomoro,Pepe Nero Primitivo Salento 2021,4.3,54
2021,1809484,4.5,"Alle superlatieven kunnen voor deze wijn uit de kast worden getrokken. Fruit, vanille, hout, zacht, perfecte afdronk. En nergens hoef je het woord te voor te zetten. Kortom een favoriet voor een nette prijs",2021-06-27T11:01:29.000Z,Cignomoro,Pepe Nero Primitivo Salento 2021,4.3,54
2021,1809484,4.5,"うますぎる。（笑）
毎年飲むノヴェッロ。ぺぺネロ。",2023-10-31T10:53:40.000Z,Cignomoro,Pepe Nero Primitivo Salento 2021,4.3,54
2021,1809484,4.1,Very nice wine,2022-12-25T14:28:25.000Z,Cignomoro,Pepe Nero Primitivo Salento 2021,4.3,54
2021,1809484,4.1,vanille pruim,2023-11-05T19:17:58.000Z,Cignomoro,Pepe Nero Primitivo Salento 2021,4.3,54
2021,1809484,4.0,"A very unusual and ancient  (Susumniello ) grape from the Brindisi region or Heel of the Boot of southern Italy.
This needs to sit and relax in order that you may enjoy. Very berry with nice tanin levels.
Well worth a try. Ours was a 2018 vi the that would seem to lay well.",2019-12-16T02:43:37.000Z,Cignomoro,Pepe Nero Primitivo Salento 2021,4.3,54
2021,1809484,4.5,"Heerlijk ronde mooie soepele 100% primitivo. Rijp zwart fruit, mooie vanille toon met heerlijk soepel afdronk",2021-10-03T19:34:49.000Z,Cignomoro,Pepe Nero Primitivo Salento 2021,4.3,54
2021,1809484,4.5,"Heeel lekker. Soepel. Vanille,eiken. Topper. Wellicht 5 sterren, maar iets steviger rood is misschien nog net iets beter.",2021-11-26T21:04:45.000Z,Cignomoro,Pepe Nero Primitivo Salento 2021,4.3,54
2021,1809484,4.5,"One of my favorite primitivo's, a will rounded, smooth bottle with hints of cherry and forest berries. Guess very well with cured meats",2020-06-12T21:10:41.000Z,Cignomoro,Pepe Nero Primitivo Salento 2021,4.3,54
2021,1809484,3.7,"Nice, a bit generic, Primitivo with notes of fresh cherry, plum and red fruit, without noticable traces of aging. Nicely crafted. Overpriced too. ",2022-05-18T18:12:09.000Z,Cignomoro,Pepe Nero Primitivo Salento 2021,4.3,54
2021,1809484,4.0,"Intense ruby-red color. Cherry and blueberry are dominant with oak spice, and smoke  supporting the fruit tones. It's Full body and intense yet a balanced nice Primitivo ",2021-10-17T06:45:49.000Z,Cignomoro,Pepe Nero Primitivo Salento 2021,4.3,54
2021,1809484,4.0,"Very tasty, deep and aromatic Primitivo di Salento.
Nose is sooo deep, full of dark fruits, dark chocolate, oak wood and sweet cherries.
Tongue is also very deep and delicate at once. Dark chocolate, vanilla, cherries, matured plums and spices are the most intensive here.
Aftertaste is very long, tannins mixed with dark cherries and cocoa are nicely combined with spices.
Colour in the glass is dark ruby, reflexes are nice ruby, legs are straight and long.
Great wine with deep taste and delicate body.
4.2:)",2018-11-24T14:27:11.000Z,Cignomoro,Pepe Nero Primitivo Salento 2021,4.3,54
2021,1809484,4.0,"4.2 ___ Primitivo de Salento is undeniable as always. Superb wine ! Intense ruby, with aromas of overripe plum and black cherries, jam, spices, mint. Dry, full-bodied, balanced, integrated alcohol, silky tannins, creamy, with jam and chocolate on the palate, a little vanilla and oak, delicious, with a long, pleasant aftertaste. Delightful !",2022-03-05T19:46:15.000Z,Cignomoro,Pepe Nero Primitivo Salento 2021,4.3,54
2021,1809484,3.9,"Pepenero Primitivo.  Medium ruby ​​color intensity, medium blackberry nose.  Off Dry, high acidity, medium + tannins, medium body.  On the palate we have blackberries, currants, spices, sour cherries.  Nice aftertaste, medium + and with a fruity background.",2023-03-29T18:02:09.000Z,Cignomoro,Pepe Nero Primitivo Salento 2021,4.3,54
2021,1809484,4.0,"🇮🇹

🍇 100% Primitivo

Intense ruby color

👃: very aromatic, red cherries, raspberries, chocolate, lily of the Nile

👅: rich and fruity, confirming the nose, wild and sweet berry jam, dark chocolate, pepper, cinnamon, a hint of smoke and leather 🎆🎇

Full body, medium tannins and acidity, m++ finish.

Liquid verse of sweetness and aromatic intensity. Exuberant essence of heat and vehemence in the mouth. 👌

Not my favorite grape but this one was a very pleasant experience.👏

ABV 14%

4.15/5 🏆 ",2021-06-28T17:14:00.000Z,Cignomoro,Pepe Nero Primitivo Salento 2021,4.3,54
2021,1809484,4.0,"Great mouth feel. Medium bodied ruby red Italian Primitivo w/notes of vanilla, blueberry, cassis, liquorice, milk chocolate, black cherry, & tobacco. ",2018-09-08T18:59:01.000Z,Cignomoro,Pepe Nero Primitivo Salento 2021,4.3,54
2021,1809484,4.5,"Fruitig, vol van smaak, lange afdronk.",2021-11-13T18:29:34.000Z,Cignomoro,Pepe Nero Primitivo Salento 2021,4.3,54
2021,1809484,4.5,"Mooie primotivo met duidelijke smaaktonen van vanille,  aards, rijp rood fruit",2022-12-03T19:16:28.000Z,Cignomoro,Pepe Nero Primitivo Salento 2021,4.3,54
2021,1809484,4.5,"Goede, soepele primitivo. Prima prijs-kwaliteit…",2021-09-01T21:06:53.000Z,Cignomoro,Pepe Nero Primitivo Salento 2021,4.3,54
2021,1809484,4.0,"Hoy toca Italia, Salento, el tacón de la bota. Gran vino, excelente nariz, punto dulce, retrogusto aromático, rico, complejo, tenéis que sentirlo",2023-11-01T19:27:55.000Z,Cignomoro,Pepe Nero Primitivo Salento 2021,4.3,54
2021,1809484,4.0,"Natuurlijk nog erg jong, maar geef deze wat lucht en je wordt verrast. Mooi boeket aan zwart fruit, gecombineerd met chocolade en leer.",2021-12-05T20:19:53.000Z,Cignomoro,Pepe Nero Primitivo Salento 2021,4.3,54
2021,1809484,4.2,"Отличный примитиво, пил в том же баре ",2023-01-13T15:50:20.000Z,Cignomoro,Pepe Nero Primitivo Salento 2021,4.3,54
2021,1809484,4.1,"Heerlijk rond, lichtzoet. Helemaal mijn stijl ik wil direct naar ItaIië!",2022-05-14T19:14:00.000Z,Cignomoro,Pepe Nero Primitivo Salento 2021,4.3,54
2021,1809484,4.3,"Iets kruidig. Zachte tannines, pruimen, bramen. Fris en rond. Elegant",2022-03-31T22:31:21.000Z,Cignomoro,Pepe Nero Primitivo Salento 2021,4.3,54
2021,1809484,4.0,"Zo deze is lekkerder dan gedacht! Mooi vol, rond en fruitig. Licht zoet maar zeker niet té en aanwezige tannines. Lekkere wijn. ",2021-12-13T18:14:23.000Z,Cignomoro,Pepe Nero Primitivo Salento 2021,4.3,54
2021,1809484,4.2,Vanille kers en hout. Lekker wijntje! ,2022-09-12T18:30:19.000Z,Cignomoro,Pepe Nero Primitivo Salento 2021,4.3,54
2021,1809484,4.7,"Zalig! 
Prachtig soepel, zwoel, precies goed ziet. vanille kers jam eiken tabak",2023-04-09T21:23:25.000Z,Cignomoro,Pepe Nero Primitivo Salento 2021,4.3,54
2021,1809484,3.5,"Usual and classic Primitivo which is deep coloured, blackberry, blueberry, chocolate, oak, vanilla smell and taste. Is little bit shorter and not so structured finesse.",2022-01-06T22:29:12.000Z,Cignomoro,Pepe Nero Primitivo Salento 2021,4.3,54
2021,1809484,4.5,"Zo heerlijk vol zie ik ze graag. Veel chocola 🍫 en vanille, dikke tranen in het glas en mooie tannines. Pak er een milde kaas bij zoals een hollandse jonge, brie of port. Blijft verder niet lang hangen, anders was het 5 sterren geweest 🤩🥂",2021-07-28T22:14:20.000Z,Cignomoro,Pepe Nero Primitivo Salento 2021,4.3,54
2021,1809484,4.0,"Good, taken a bit cold, I think better if not cold",2020-08-21T11:23:22.000Z,Cignomoro,Pepe Nero Primitivo Salento 2021,4.3,54
2021,1809484,4.0,Red to violet brownish colour with amazing depth of oak and vanilla aromas. ,2020-08-28T19:31:04.000Z,Cignomoro,Pepe Nero Primitivo Salento 2021,4.3,54
2021,1809484,4.7,"At 14 percent alcohol, this is a dream of an intense, immense wine, with briary black raspberry fruit and a chocolate-covered-cherry character.",2023-10-07T18:08:04.000Z,Cignomoro,Pepe Nero Primitivo Salento 2021,4.3,54
2021,1809484,4.0,"Eiken, licht vanille en donker fruit in de neus.  Smaak medium tot volle body, eiken, bosbessen en wat drop. ",2021-07-16T21:02:17.000Z,Cignomoro,Pepe Nero Primitivo Salento 2021,4.3,54
2021,1809484,4.5,"Heerlijke, zachte primitivo. Geur van kruiden. Smaak van rood fruit, frambozen en kruidig, laurier, kruidnagel en iets van chocola. Vrij lange afdronk. ",2021-11-01T12:18:25.000Z,Cignomoro,Pepe Nero Primitivo Salento 2021,4.3,54
2021,1809484,4.5,"Wat een genot! Soepel een complex tegelijk. Heerlijke volle wijn, kruidig, fruitig, kers en lekker wat hout. Mooi in balans. pruim kers eiken jam zwarte bes",2023-11-02T19:21:43.000Z,Cignomoro,Pepe Nero Primitivo Salento 2021,4.3,54
2021,1809484,4.2,"Wat een topper deze Pepe Nero!!
De verwachtingen waren hoog gespannen en ze werden overtroffen!! 
Robijnrood met paarse hinten in het glas. Een intens fruitig bouquet aan aroma's zoals wilde aardbeien, kersen, zwarte bessen, bramen en viooltjes. De wijn geeft een zijde zachte structuur met veel fruit in de smaak.
 Een blend van Negroamaro, Primitivo en Malvasia Nero, GEWELDIG!",2022-06-12T07:45:04.000Z,Cignomoro,Pepe Nero Primitivo Salento 2021,4.3,54
2021,1809484,4.0," Wild berry, Jam vanilla blackcurrant cherry",2021-09-21T00:38:23.000Z,Cignomoro,Pepe Nero Primitivo Salento 2021,4.3,54
2021,1809484,4.0,"Baked plum, very fruit forward food wine. Really nice. ",2021-08-19T23:10:27.000Z,Cignomoro,Pepe Nero Primitivo Salento 2021,4.3,54
2021,1809484,3.9,"Black fruit, oak, laurel",2022-06-28T13:00:45.000Z,Cignomoro,Pepe Nero Primitivo Salento 2021,4.3,54
2021,1809484,4.0,"Fruit forward, tart, raspberry",2022-10-09T22:07:26.000Z,Cignomoro,Pepe Nero Primitivo Salento 2021,4.3,54
2021,1809484,4.0,"Solid quality wine for a friendly price. 
Nice taste.   Bit thick",2022-03-02T18:44:08.000Z,Cignomoro,Pepe Nero Primitivo Salento 2021,4.3,54
2021,1809484,4.0,"Full bodied, smooth ripe red and black fuits, hint of soft tannin
",2022-02-27T17:55:30.000Z,Cignomoro,Pepe Nero Primitivo Salento 2021,4.3,54
2021,1809484,4.0,"Prima jonge Primitivo (14%), heerlijk zacht en soepel. Lekkere wijn via Vivino. Aanrader! Ging vlot naar binnen  bij de borrel met Kees en Annet op de camping bij Ootmarsum. ",2021-09-04T16:36:34.000Z,Cignomoro,Pepe Nero Primitivo Salento 2021,4.3,54
2021,1809484,3.5,"Primitivo with a deep ruby red colour in the glass, a medium intense nose with dark cherry, cassis and plum. Some licorice, clove, vanilla and spices as well. Medium+ body with medium acidity and mellow tannins, leading to a medium- finish.",2022-11-05T18:29:50.000Z,Cignomoro,Pepe Nero Primitivo Salento 2021,4.3,54
2021,1809484,3.5,"oak jam plum cherry remarkably good considering the price, although the oak taste, which is good per se, tends to mask the other aromas. Not at the top of primitivos, but still good and with some interesting and very peculiar flavours.",2021-07-13T09:11:08.000Z,Cignomoro,Pepe Nero Primitivo Salento 2021,4.3,54
