Year,Wine ID,User Rating,Note,CreatedAt,Winery,Wine,Rating,Rates count
1952,1227674,4.0,Voto: 8. Data di degustazione: 12/8/2014.,2014-08-12T18:57:16.000Z,Cantina Sampietrana,Since 1952 Riserva 1952,4.4,48
1952,1227674,3.5,"Rosso granata cristallino, corposo, naso intenso e complesso, sentori fruttati, speziati e tostati, tra tutti, frutti a bacca nera, more, vaniglia, pepe nero, quecia, fungo, humus, cuoio... In bocca equilibrato tra morbidezze e acidità, buona persistenza, di qualità fine, pronto. Ottimo con carni",2020-12-26T04:42:00.000Z,Cantina Sampietrana,Since 1952 Riserva 1952,4.4,48
1952,1227674,4.0,"Seppur non di grande struttura, l'esplosione degli elementi odorosi con l'evidente presenza vanigliata lo rendono piacevolmente e lungamente persistente...è un grande vino.Lo consiglio a tutti",2016-07-09T19:52:55.000Z,Cantina Sampietrana,Since 1952 Riserva 1952,4.4,48
1952,1227674,4.0,Gradevole al palato abbastanza profumato...qualità prezzo eccelsa,2021-05-14T21:13:04.000Z,Cantina Sampietrana,Since 1952 Riserva 1952,4.4,48
1952,1227674,4.0,"È' un ottimo connubio di sapori fruttati con un retrogusto morbido. Buono il rapporto qualita' prezzo
Paolo Confalone",2015-12-19T13:55:55.000Z,Cantina Sampietrana,Since 1952 Riserva 1952,4.4,48
1952,1227674,4.5,Ottima Malvasia molto meno ruffiana di altri vini. Davvero una splendida scoperta. Legno e mora prevalgono,2022-01-06T13:18:00.000Z,Cantina Sampietrana,Since 1952 Riserva 1952,4.4,48
1952,1227674,4.0,"Intenso e fruttato, color rubino.Ottimo su carni e formaggi stagionati. Sicuramente non economico e forse sopravvalutato",2016-06-11T13:50:42.000Z,Cantina Sampietrana,Since 1952 Riserva 1952,4.4,48
1952,1227674,4.5,Buonoq qualita a prezzo contenuto,2020-10-04T18:09:13.000Z,Cantina Sampietrana,Since 1952 Riserva 1952,4.4,48
1952,1227674,4.0,Sapido e persistente al palato. Straordinario rapporto qualità prezzo.,2015-08-20T20:32:30.000Z,Cantina Sampietrana,Since 1952 Riserva 1952,4.4,48
1952,1227674,5.0,"Rapporto qualità prezzo impareggiabile. Gusto rotondo, tannini medi e piacevoli, profumi morbidi di frutta e botte.  
Davvero consigliato. ",2021-02-03T09:44:16.000Z,Cantina Sampietrana,Since 1952 Riserva 1952,4.4,48
1952,1227674,4.1,Qualità prezzo ottima,2023-03-05T13:35:59.000Z,Cantina Sampietrana,Since 1952 Riserva 1952,4.4,48
1952,1227674,4.0,Corposo. ottima qualità prezzo.,2015-02-04T19:38:28.000Z,Cantina Sampietrana,Since 1952 Riserva 1952,4.4,48
1952,1227674,3.0,"Rosso rubino, nel naso more e mirtilli, alcune note speziate.In bocca prevalgono note speziate ed erbacee abbracciate dai frutti  sentiti all'olfatto.",2018-06-12T19:24:15.000Z,Cantina Sampietrana,Since 1952 Riserva 1952,4.4,48
1952,1227674,3.0,"Buon vinello, rubino di colore e intenso di sapore. Note di frutti di bosco se ben ossidato.",2022-02-02T12:18:46.000Z,Cantina Sampietrana,Since 1952 Riserva 1952,4.4,48
1952,1227674,2.5,Buono con cibi a base di carne. A mio gusto forse un po troppo pesante.,2017-11-02T18:46:40.000Z,Cantina Sampietrana,Since 1952 Riserva 1952,4.4,48
1952,1227674,2.5,Profumi dolciastro accennato un po' di legno in bocca fruttato poca acidità media persistenza ,2018-11-13T19:15:27.000Z,Cantina Sampietrana,Since 1952 Riserva 1952,4.4,48
1952,1227674,4.0,"Negramaro con una piccola percentuale di Montepulciano, un mix perfetto...
Morbido e vellutato corposo e asciutto, gusto persistente,
ottimo rapporto qualità  prezzo
uno dei miei preferiti.",2016-08-23T22:26:20.000Z,Cantina Sampietrana,Since 1952 Riserva 1952,4.4,48
1952,1227674,3.2,"Si si... e'un buon vino, buon qualità prezzo,degustato con carne argentina e arrosticini alla brace va giù veramente bene buono..👍👍👍",2022-11-27T12:47:45.000Z,Cantina Sampietrana,Since 1952 Riserva 1952,4.4,48
1952,1227674,5.0,"Non sono un esperto, ma è buonissimo. Sto imparando a capire cosa mi piace e non, bevo vino da 7,5 euro fino ad arrivare a 20 euro (prezzo enoteca non ristorante ovviamente) questo l’ho pagato 8 ma pagherei volentieri 20 per berlo. So di non essere d’aiuto ma ho detto la mia",2020-01-13T19:05:24.000Z,Cantina Sampietrana,Since 1952 Riserva 1952,4.4,48
1952,1227674,5.0,"Ottimo vino soprattutto calcolando che L ho potuto acquistare in una normalissima macelleria e a un preZzo inferiore alla quotazione che riporta qui (7,50€) . Riserva 2010. 8 anni passati splendidamente ",2018-02-03T19:34:44.000Z,Cantina Sampietrana,Since 1952 Riserva 1952,4.4,48
1952,1227674,4.0,"Elegante, morbido al palate e persistente.
Rosso rubino con unghie granate.
Da consigliare",2017-04-08T19:01:09.000Z,Cantina Sampietrana,Since 1952 Riserva 1952,4.4,48
1952,1227674,5.0,"Aroma vinoso e note di frutti di bosco. Affinato in piccole botti di rovere. Sapore delicato, giustamente tannico è molto persistente. Accompagna bene primi piatti speziati, arrosti di carne e formaggi stagionati.",2017-06-07T09:14:42.000Z,Cantina Sampietrana,Since 1952 Riserva 1952,4.4,48
1952,1227674,4.0,"Odore intenso di frutti rossi, profumato, colore rosso rubino. Veramente molto buono 
",2019-08-04T20:40:32.000Z,Cantina Sampietrana,Since 1952 Riserva 1952,4.4,48
1952,1227674,5.0,Ottimo rosso da abbinare anche con pesce,2019-05-25T12:07:49.000Z,Cantina Sampietrana,Since 1952 Riserva 1952,4.4,48
1952,1227674,5.0,Favoloso. Ottimo con agnello ,2018-12-28T21:06:29.000Z,Cantina Sampietrana,Since 1952 Riserva 1952,4.4,48
1952,1227674,5.0,Uno dei miei preferiti! La persistenza è la caratteristica migliore ,2018-01-20T21:28:05.000Z,Cantina Sampietrana,Since 1952 Riserva 1952,4.4,48
1952,1227674,4.0,"Ottimo vino strutturato , si sente il rovere",2018-11-04T13:03:11.000Z,Cantina Sampietrana,Since 1952 Riserva 1952,4.4,48
1952,1227674,4.0,Ottima rapporto qualità-prezzo,2017-12-07T22:22:32.000Z,Cantina Sampietrana,Since 1952 Riserva 1952,4.4,48
1952,1227674,4.0,Un prodotto davvero ottimo. Complimenti,2017-02-10T09:10:50.000Z,Cantina Sampietrana,Since 1952 Riserva 1952,4.4,48
1952,1227674,5.0,"Eccellente, corposo e delicato insieme, rapporto costo/qualita semplicemente stupefacente.",2017-03-26T12:19:41.000Z,Cantina Sampietrana,Since 1952 Riserva 1952,4.4,48
1952,1227674,5.0,Ottimo se hai intenzione di ubriacarti 🤕,2019-04-20T19:44:20.000Z,Cantina Sampietrana,Since 1952 Riserva 1952,4.4,48
1952,1227674,4.0,"Rosso rubino intenso impenetrabile denso
 mora pepe vaniglia 
Caldo.
Fine
Persistente.
Pronto",2023-06-24T22:26:14.000Z,Cantina Sampietrana,Since 1952 Riserva 1952,4.4,48
1952,1227674,5.0,Ottimo....fruttato al punto giusto,2017-05-21T11:23:45.000Z,Cantina Sampietrana,Since 1952 Riserva 1952,4.4,48
1952,1227674,4.0,Ottimo rapporto qualità/prezzo,2018-12-24T21:09:19.000Z,Cantina Sampietrana,Since 1952 Riserva 1952,4.4,48
1952,1227674,4.0,"Profumato ottimo qualità prezzo 
",2021-08-05T08:16:59.000Z,Cantina Sampietrana,Since 1952 Riserva 1952,4.4,48
1952,1227674,3.6,"Buono, semplice ma interessante ",2023-03-07T20:24:59.000Z,Cantina Sampietrana,Since 1952 Riserva 1952,4.4,48
1952,1227674,4.0,"Ripe berry fruits, blackberry and cherry. Tanins softened quickly, full bodied, hot finish.",2020-12-24T23:00:27.000Z,Cantina Sampietrana,Since 1952 Riserva 1952,4.4,48
1952,1227674,4.0,"Deep ruby, silky, big fruit  and oak background ",2021-06-16T21:50:01.000Z,Cantina Sampietrana,Since 1952 Riserva 1952,4.4,48
1952,1227674,3.8,Ottima scoperta si accompagna molto con selvaggina e formaggi.,2022-11-09T16:31:32.000Z,Cantina Sampietrana,Since 1952 Riserva 1952,4.4,48
1952,1227674,4.0,"Rijpe en aardse smaken.
stevige wijn. 
altijd een goede keuze en met veel verschillende gerechten combineerbaar. ",2019-10-08T16:05:38.000Z,Cantina Sampietrana,Since 1952 Riserva 1952,4.4,48
1952,1227674,4.5,"
",2021-02-01T21:14:30.000Z,Cantina Sampietrana,Since 1952 Riserva 1952,4.4,48
1952,1227674,3.0,"Vino dal coloro rosso mattone. Non molto corposo, leggermente fruttato. 
",2019-12-31T19:31:24.000Z,Cantina Sampietrana,Since 1952 Riserva 1952,4.4,48
1952,1227674,4.8,Prachtig ,2022-05-07T14:52:39.000Z,Cantina Sampietrana,Since 1952 Riserva 1952,4.4,48
1952,1227674,5.0,Molto fruttato annata 2011 pieno di profumi di ciliegia ottimo con le carni rosse,2015-01-23T14:22:29.000Z,Cantina Sampietrana,Since 1952 Riserva 1952,4.4,48
1952,1227674,4.2,"dark fruit vanilla smoke pepper
Very bold and smooth, no tannin, with a finish of pepper on the tongue ",2023-03-24T12:46:23.000Z,Cantina Sampietrana,Since 1952 Riserva 1952,4.4,48
1952,1227674,5.0,"Very good Italian. 
",2021-01-02T18:47:20.000Z,Cantina Sampietrana,Since 1952 Riserva 1952,4.4,48
1952,1227674,4.0,ほどよい酸味、果実味でスモーキー,2020-03-31T09:50:15.000Z,Cantina Sampietrana,Since 1952 Riserva 1952,4.4,48
1952,1227674,4.5,"Full body, intense dark purple color, velvety texture, tons of cherries, smoky oak, cinnamon and dark bitter chocolate. Delicious ",2020-05-08T08:21:18.000Z,Cantina Sampietrana,Since 1952 Riserva 1952,4.4,48
1952,1227674,4.5,"Excellent wine from Puglia. Aromas of forest fruit, mushrooms, and spices. On the palate is abundant in black fruits with smooth tannins.",2018-10-05T19:26:26.000Z,Cantina Sampietrana,Since 1952 Riserva 1952,4.4,48
1952,1227674,4.5,"Powerful scent which last long even decant a couple days. Well balanced one, with aroma of dark fruit, plum and pleasant oak. Do enjoy so👍",2021-07-20T15:19:18.000Z,Cantina Sampietrana,Since 1952 Riserva 1952,4.4,48
1952,1227674,4.2,"oak plum dark fruit smoke, great aurora to this wine. The wine maker has put up some incredible wines. Not to far from Bari. Lovely at a good price ",2022-11-10T19:59:44.000Z,Cantina Sampietrana,Since 1952 Riserva 1952,4.4,48
1952,1227674,4.1,"Really nice red, it’s got lovely warming oomph, lush red and black fruit palate, deep and velvety with a touch of tannin creating that lovely finish",2023-06-28T22:49:12.000Z,Cantina Sampietrana,Since 1952 Riserva 1952,4.4,48
1952,1227674,4.3,"Beautifully balanced wine, Lovely accompaniment to tapas, fine jamon and Spanish food. I wonder if that’s what the Italian producers intended?",2019-06-02T09:19:02.000Z,Cantina Sampietrana,Since 1952 Riserva 1952,4.4,48
1952,1227674,4.5,"Delicious. Cherries, plums, blackberries and a little bit of cinnamon and chocolate. Harmonic. Long and pleasant finish. Highly recommended.",2018-02-04T00:15:55.000Z,Cantina Sampietrana,Since 1952 Riserva 1952,4.4,48
1952,1227674,4.5,"Supple and light nose with hints of pepper. Red fruits dominate and the tannins are now overpowering. Pepper on the finish is lighter than expected, and it rounds very well.",2018-09-30T13:33:13.000Z,Cantina Sampietrana,Since 1952 Riserva 1952,4.4,48
1952,1227674,4.5,"👁 deep purple red 
👃🏼 vanilla , oak cherry and a lovely hint of maple syrup sweetness
👅 tannic with medium finish. Dark fruit , and pepper and flavours that match the aromas. All the flavours really blend together excellently. ",2020-07-05T18:38:29.000Z,Cantina Sampietrana,Since 1952 Riserva 1952,4.4,48
1952,1227674,4.0,"Great stuff from The Vineyard in Ramsbottom. Their #1 selling wine apparently and I’m not surprised. Full bodied, blackcurrant pepper and cloves. Robust. Great with spicy Nduja pizza from nearby Tre Cicchio! ",2021-04-30T19:20:50.000Z,Cantina Sampietrana,Since 1952 Riserva 1952,4.4,48
1952,1227674,4.5,"What I'd call a baby Primitivo in the sense it's not as robust as some of the recent versions I've had from San Marzano but very nice nonetheless. Plenty of oak, cherries and of course the bold dark berry flavour you'd expect plus a nice lingering finish. Great for the price range too paying under 13 quid in Bottle Apostle. ",2020-04-26T15:08:30.000Z,Cantina Sampietrana,Since 1952 Riserva 1952,4.4,48
1952,1227674,4.0,"Cuvée Negroamaro and Montepulciano (80/20%); Bright garnet color; nose: nice deep aromas dominated by pepper, oak and plum; taste is full, long persistence, oak, vanilla, plum; med+ body, acidity med, tannins med-  ",2021-10-29T19:18:41.000Z,Cantina Sampietrana,Since 1952 Riserva 1952,4.4,48
1952,1227674,4.2,"Deep, dark fruits on the nose - blackberries and plums.  And, on the palate there's blueberry fruit and terrific energy and acidity.  The mouth feel is generous, and well balanced.
A tremendous drop of red, from an underrated region - more please!

[A gift from #2 son; thank you, David....]",2023-01-08T11:25:38.000Z,Cantina Sampietrana,Since 1952 Riserva 1952,4.4,48
1952,1227674,4.2,"Cherry, plum, red peach. High tannins but we'll integrated. Good acidity. Nice primary notes. Elegant oak finish. Well balanced.  This wine doesn't want to be overly complex. That's not the point here. Very good wine.",2023-01-04T19:26:00.000Z,Cantina Sampietrana,Since 1952 Riserva 1952,4.4,48
1952,1227674,4.0,Very nice. Oaky. Dark fruits with a dry finish. Hint of vanilla. ,2019-03-19T22:51:12.000Z,Cantina Sampietrana,Since 1952 Riserva 1952,4.4,48
1952,1227674,4.0,"Dry enough,cherry, soft tannins, very balanced.",2018-01-25T18:18:27.000Z,Cantina Sampietrana,Since 1952 Riserva 1952,4.4,48
1952,1227674,4.0,Soft and strong and lovely,2016-04-16T12:36:59.000Z,Cantina Sampietrana,Since 1952 Riserva 1952,4.4,48
1952,1227674,4.5,"Corpo médio, sem sedimentos, vermelho ocre, frutas negras, toque adocicado, álcool bem incorporado, pouco tanino. Vinho muito bom!!!",2018-04-02T02:05:04.000Z,Cantina Sampietrana,Since 1952 Riserva 1952,4.4,48
1952,1227674,4.0,"Body towards medium, black currant, pepper and cloves. Refreshing enough on its own and complex enough to pair with foods. Good value! ",2021-09-18T15:00:23.000Z,Cantina Sampietrana,Since 1952 Riserva 1952,4.4,48
1952,1227674,4.5,"Jam, black cherry, dark fruit, oak and pepper flavours in this lovely smooth and medium bodied red. ",2019-09-16T20:13:53.000Z,Cantina Sampietrana,Since 1952 Riserva 1952,4.4,48
1952,1227674,4.1,I couldn't agree more with Simon's review. There is a very particular oomph in this wine. Irrestible!,2023-09-12T12:05:32.000Z,Cantina Sampietrana,Since 1952 Riserva 1952,4.4,48
1952,1227674,4.5,"Agree with the tasting notes of oak, vanilla and spices. Ate it with spiced meat and pasta and paired wonderfully. ",2020-05-04T09:33:33.000Z,Cantina Sampietrana,Since 1952 Riserva 1952,4.4,48
1952,1227674,4.5,"Well balance wine, good price and should get more!",2020-11-08T11:27:50.000Z,Cantina Sampietrana,Since 1952 Riserva 1952,4.4,48
1952,1227674,4.5,Dinner party in Seaview ,2020-08-04T11:21:37.000Z,Cantina Sampietrana,Since 1952 Riserva 1952,4.4,48
1952,1227674,4.0,"Very good wine but just not my taste. Blackberry, black plum, black cherry, chocolate, oak, leather. Full body and silky tannins ",2023-05-04T19:08:51.000Z,Cantina Sampietrana,Since 1952 Riserva 1952,4.4,48
1952,1227674,4.5,"Excellent value!  Big, warm, and lovely spice.  Just enough tannins and balance.",2017-10-16T10:35:58.000Z,Cantina Sampietrana,Since 1952 Riserva 1952,4.4,48
1952,1227674,4.4,"Oak, vanilla, smoke, cherry

Nice wine. 
Needs to wait open at least 1 hour ",2023-04-08T20:12:05.000Z,Cantina Sampietrana,Since 1952 Riserva 1952,4.4,48
1952,1227674,4.0,"Very enjoyable deep ruby red, black currant and plum flavours and a little oak. ",2021-04-10T10:30:53.000Z,Cantina Sampietrana,Since 1952 Riserva 1952,4.4,48
1952,1227674,4.5,"Prunes, cherry, dates, blackberry and loads of booze. Excellent.",2018-02-11T00:50:25.000Z,Cantina Sampietrana,Since 1952 Riserva 1952,4.4,48
1952,1227674,4.5,Swelteringly good! So intense and fruity,2020-12-14T20:26:25.000Z,Cantina Sampietrana,Since 1952 Riserva 1952,4.4,48
1952,1227674,4.2,"Nice ruby red color. Deep, fruit and jammy. Full body with nice finish. ",2023-03-26T18:49:50.000Z,Cantina Sampietrana,Since 1952 Riserva 1952,4.4,48
1952,1227674,4.5,"2011 and amazing in 2017 - spice, rich and so disappointed I drank the others in 2015 ",2017-09-02T17:19:30.000Z,Cantina Sampietrana,Since 1952 Riserva 1952,4.4,48
1952,1227674,4.5,Light red fruit. Atypical southern Italian red.,2022-02-20T10:46:39.000Z,Cantina Sampietrana,Since 1952 Riserva 1952,4.4,48
1952,1227674,4.0,"Plum, red fruit, oak, dried fruit, smoke, vanilla ",2020-11-05T12:39:01.000Z,Cantina Sampietrana,Since 1952 Riserva 1952,4.4,48
1952,1227674,4.0,"Lovely dark fruit - blackberry and morello cherry, soft rounded tannins and a nice long finish.",2014-05-15T09:07:16.000Z,Cantina Sampietrana,Since 1952 Riserva 1952,4.4,48
1952,1227674,4.0,dark cherry vanilla and oak spice - very smooth,2021-05-22T23:02:00.000Z,Cantina Sampietrana,Since 1952 Riserva 1952,4.4,48
1952,1227674,4.0,"Lots of dark fruit, hint of smoke and oak.",2021-06-12T19:22:08.000Z,Cantina Sampietrana,Since 1952 Riserva 1952,4.4,48
1952,1227674,4.5,"Smooth, big cherries, vanilla, slightly sweet, very very drinkable",2021-05-22T19:10:14.000Z,Cantina Sampietrana,Since 1952 Riserva 1952,4.4,48
1952,1227674,4.5,"Fantastic flavours, intense fruit and caramel ",2016-08-26T14:13:26.000Z,Cantina Sampietrana,Since 1952 Riserva 1952,4.4,48
1952,1227674,4.5,"That’s a lot of wine for that price buy, buy, buy!",2021-10-16T20:03:32.000Z,Cantina Sampietrana,Since 1952 Riserva 1952,4.4,48
1952,1227674,4.5,Light but not too light - smooth and easy to drink ,2019-09-12T12:08:21.000Z,Cantina Sampietrana,Since 1952 Riserva 1952,4.4,48
1952,1227674,4.0,"A beautiful blend I could’ve drunk all night. An excellent palate of cherries, blackberries and a creamy soft finish. Big on the nose",2019-08-31T05:39:14.000Z,Cantina Sampietrana,Since 1952 Riserva 1952,4.4,48
1952,1227674,4.4,"Sehr feiner fruchtiger italienischer Rotwein 🍷, schöner rot leicht gelblich Farbton. Ganze leichte süsslich. Leicht und trotzdem kräftig auf der Zunge und im Abgang 14.5% ",2022-05-24T17:17:05.000Z,Cantina Sampietrana,Since 1952 Riserva 1952,4.4,48
1952,1227674,4.5,"Vinho forte, levemente adocicado, com tanino marcante e presença de madeira. Muito gostoso separadamente, mas ao harmonizar com o jantar, ficou perfeito! Magret de Pato com risoto de trufas negras!",2018-07-08T12:27:28.000Z,Cantina Sampietrana,Since 1952 Riserva 1952,4.4,48
1952,1227674,4.5,"Heel erg lekkere wijn. Heel erg lekker vol van geur, beetje fris. Ook soepel. Beetje pit. 1ste glas lijkt een doorzuipertje, daarna merk je dat dit verre van het geval is.",2019-02-22T20:12:49.000Z,Cantina Sampietrana,Since 1952 Riserva 1952,4.4,48
1952,1227674,4.4,"Piękne wino. Jeszcze lepsze niż ostatnio degustowane. Ciemne, leśne owoce w aromacie. W smaku wręcz słodkie. Tanina wspaniała, miękka i delikatna. Kwasu zero. Ale nie jest to ulepek.",2023-05-21T15:39:21.000Z,Cantina Sampietrana,Since 1952 Riserva 1952,4.4,48
1952,1227674,4.0,"Eleganza estrema per un rosso che garantisce equilibrio, tannini moderati. profumi di pepe rosa e prugne ",2021-03-24T21:23:21.000Z,Cantina Sampietrana,Since 1952 Riserva 1952,4.4,48
1952,1227674,3.5,"Dried fruit, spice. Jammy ripeness and a thin layer of acidity bound in grippy  tannins.  Juicy, fruity, bramble and spiced damson. Good blend of the pugliese holy trinity. 
Primitivo, negro amaro and Montepulciano",2018-10-20T18:59:20.000Z,Cantina Sampietrana,Since 1952 Riserva 1952,4.4,48
1952,1227674,3.5,"What I'd call a proper winter warmer.

Sun drenched black fruit straight up, with herby and minty notes too.

Juicy with good structure and medium tannins and a minty, fresh finish that lingers.

Recommended by the helpful staff in Bottle Apostle, Crouch End.",2016-01-23T22:15:59.000Z,Cantina Sampietrana,Since 1952 Riserva 1952,4.4,48
1952,1227674,4.0,"Amazing from the word go

Awesome flavour and what a balanced wine with low tanins and sweetness.

you should have atleast few bottles of these in your cellar 
",2022-03-26T13:02:57.000Z,Cantina Sampietrana,Since 1952 Riserva 1952,4.4,48
1952,1227674,4.0,Pretty solid Italian red. Woody,2021-04-03T17:22:33.000Z,Cantina Sampietrana,Since 1952 Riserva 1952,4.4,48
1952,1227674,4.2,"ein Blend aus Negroamaro und Montepulciano. Ein Jahr im Barrique ausgereift. Typisch Toscana:Kräuter, Garrigue, Rosmarin. Schwazre Johannisbeere und Cassis. Im Gaumen sauber ausgereift, saftig, unbekümmert. Säure, Tannine, alles sauber und perfekt rund. Eine Ueberraschung! ",2023-03-31T18:37:33.000Z,Cantina Sampietrana,Since 1952 Riserva 1952,4.4,48
1952,1227674,4.2,"Dobre. Korek naturalny. Kolor mocno rubinowy.
W zapachu wiśnie z owocami leśnymi i lekko balsamicznym tle. W smaku, jako że  to połączenie negroamaro i montepulciano czereśnia na lekko czekoladowo-karmelowym tle z ziołowymi akcentami i pikantnoscia finiszu. Lekkie taniny I dobry balans dopełniają całości.  Wymaga dłuższego oddechu by wydobyć dobro w nim zawarte. Warte powtórzenia.",2023-08-19T16:03:49.000Z,Cantina Sampietrana,Since 1952 Riserva 1952,4.4,48
1952,1227674,4.0,"This is wine that made by my favorite grape Negroamaro.
Dark garnet color.
Blueberry, plum, oak, tobacco or vanilla aroma.
Moderated and rounded tannins, soft and calm acidity, ripen fruity taste.
It was smooth and very nice wine so it's my type 😋

これは私のお気に入りの葡萄の一つネグロアマーロで作られたワインです。
濃いガーネット色で、ブルーベリー、プラム、オーク、タバコ、バニラの香り。
程よく丸みを帯びたタンニン、ソフトで穏やかな酸味、熟した果実味。
口当たりが良くとても美味しいワインです 😋",2021-05-27T12:45:18.000Z,Cantina Sampietrana,Since 1952 Riserva 1952,4.4,48
1952,1227674,4.5,"Estupendo italiano! 18 meses em barricas de carvalho francês. Aos olhos negroamaro, ao nariz especiarias e chocolate. De taninos muito finos, final longo e persistente. Recomendo com extremo louvor. Saúde amigos!
Great Italian! 18 months in French oak barrels. In the eyes blackberry, nose spices and chocolate. Of very fine tannins, long and persistent finish. I recommend it with extreme praise. Cheers friends! 🍷",2019-02-26T01:17:31.000Z,Cantina Sampietrana,Since 1952 Riserva 1952,4.4,48
1952,1227674,4.3,"17,5 pts / 20 

Udseende: Medium rubinrød 
Glas: Universal 

Duft: Kirsebær, marmelade, boysenbær, oliventapenade, asfalt/tjære, muldjord, nelliker, urter, peber,

Smag: Kirsebær, tranebær, blomme, boysenbær, svesker aske, vanilje, peber, lakrids, 

Balance: Plus alkohol, syre og tannin med medium frugtsødme
Længde: Medium 
Kompleksitet: Høj
Intensitet: Medium-plus 

Konklusion: Merlot lignende syditaliener med god udvikling og Kompleksitet!",2022-04-16T17:11:42.000Z,Cantina Sampietrana,Since 1952 Riserva 1952,4.4,48
1952,1227674,4.1,"Elegant, nice tannins, fruit",2022-10-02T13:46:51.000Z,Cantina Sampietrana,Since 1952 Riserva 1952,4.4,48
1952,1227674,4.0,excellent quality price,2014-09-19T19:12:21.000Z,Cantina Sampietrana,Since 1952 Riserva 1952,4.4,48
1952,1227674,4.1,@HetArchief A’pen,2023-10-13T13:19:13.000Z,Cantina Sampietrana,Since 1952 Riserva 1952,4.4,48
1952,1227674,4.5,家宴眾人評分非常高，醒酒時間要1小時以上。葡萄為80% Negroamaro (黑曼羅)與20% Montepulciano (蒙帕賽諾)。,2020-12-12T14:14:11.000Z,Cantina Sampietrana,Since 1952 Riserva 1952,4.4,48
1952,1227674,4.0,ラッセ3杯目。美味しい〜 チーズのラビオリに合う！,2014-07-21T05:12:04.000Z,Cantina Sampietrana,Since 1952 Riserva 1952,4.4,48
1952,1227674,4.5,"Âmbar, toque de chocolate e amora. Final persistente. Excelente. ",2018-01-28T01:34:59.000Z,Cantina Sampietrana,Since 1952 Riserva 1952,4.4,48
1952,1227674,4.5,Marque. Ossenstaart ,2021-04-11T18:46:44.000Z,Cantina Sampietrana,Since 1952 Riserva 1952,4.4,48
1952,1227674,4.0,略甜,2021-11-30T13:17:16.000Z,Cantina Sampietrana,Since 1952 Riserva 1952,4.4,48
1952,1227674,4.1,Overachiever,2022-06-29T13:57:27.000Z,Cantina Sampietrana,Since 1952 Riserva 1952,4.4,48
1952,1227674,4.0,"3.85, Magnum Flasche",2017-05-24T16:58:37.000Z,Cantina Sampietrana,Since 1952 Riserva 1952,4.4,48
1952,1227674,4.0,"Vanilla,  plum, smoke, ",2021-09-11T16:52:09.000Z,Cantina Sampietrana,Since 1952 Riserva 1952,4.4,48
1952,1227674,4.0,Excellent ,2020-08-31T18:36:40.000Z,Cantina Sampietrana,Since 1952 Riserva 1952,4.4,48
1952,1227674,4.0,Molto buono...,2016-01-24T19:09:00.000Z,Cantina Sampietrana,Since 1952 Riserva 1952,4.4,48
1952,1227674,4.5,"Ótimo!!
",2018-02-16T14:00:03.000Z,Cantina Sampietrana,Since 1952 Riserva 1952,4.4,48
1952,1227674,4.0,(3.9),2020-11-09T10:32:03.000Z,Cantina Sampietrana,Since 1952 Riserva 1952,4.4,48
1952,1227674,4.5,うまー！大好き！,2018-09-03T13:14:02.000Z,Cantina Sampietrana,Since 1952 Riserva 1952,4.4,48
1952,1227674,4.0,"Not the fruit explosion you’d find from a younger Primitivo. Elegant smoke and dark stone fruits, prune colour in the glass. Silky in the mouth, minerals in the taste. ",2022-06-19T17:11:01.000Z,Cantina Sampietrana,Since 1952 Riserva 1952,4.4,48
1952,1227674,4.5,"Very good wine, good body and smooth taste. Our house Italian table wine!",2021-02-14T23:37:10.000Z,Cantina Sampietrana,Since 1952 Riserva 1952,4.4,48
1952,1227674,4.5,I like the taste. It has a sweetish aftertaste with a fruity accent.,2020-02-04T18:45:01.000Z,Cantina Sampietrana,Since 1952 Riserva 1952,4.4,48
1952,1227674,4.0,"Whats to say, mt. D'abruzzo, fresh and summerish",2014-07-23T19:07:46.000Z,Cantina Sampietrana,Since 1952 Riserva 1952,4.4,48
1952,1227674,4.5,Extremely good value for money ! Superb blending... ,2020-05-07T20:09:43.000Z,Cantina Sampietrana,Since 1952 Riserva 1952,4.4,48
1952,1227674,4.5,Very good indeed. Smooth. Very strong,2020-12-29T11:02:24.000Z,Cantina Sampietrana,Since 1952 Riserva 1952,4.4,48
1952,1227674,4.0,"Very nice southern Italian red. Notes of cherry, blackberry, oak, strawberry and plum. Medium/heavy tannin with smooth tannin. A nice hearty drink and great with a nice simple pasta",2021-10-27T14:46:14.000Z,Cantina Sampietrana,Since 1952 Riserva 1952,4.4,48
1952,1227674,4.0,"Very good wine.
Medium ruby colour.
Clove, black pepper, coconut, vanilla, liquorice, plums, sour cherries aromas and flavours.
Medium + tannins.
Medium + acidity.
Medium + body.
Medium + finish.",2018-10-03T18:23:00.000Z,Cantina Sampietrana,Since 1952 Riserva 1952,4.4,48
